[
  {
    "id": 101,
    "uuid": "post-1234-5678-9012",
    "title": "Understanding Traits in PHP",
    "slug": "understanding-traits-in-php",
    "status": "published",
    "tags": ["php", "traits", "oop"],
    "meta": {
      "views": 350,
      "likes": 45,
      "comments": 12
    },
    "published_at": "2024-10-01T08:00:00Z",
    "created_at": "2024-09-15T08:00:00Z",
    "updated_at": "2024-10-01T08:05:00Z"
  },
  {
    "id": 102,
    "uuid": "post-1234-5678-9012",
    "title": "Understanding Traits in PHP",
    "slug": "understanding-traits-in-php",
    "status": "published",
    "tags": ["php", "traits", "oop"],
    "meta": {
      "views": 350,
      "likes": 45,
      "comments": 12
    },
    "published_at": "2024-10-01T08:00:00Z",
    "created_at": "2024-09-15T08:00:00Z",
    "updated_at": "2024-10-01T08:05:00Z"
  }
]
